id,title,date_release,date_research,price,discount_price,developer,publisher,description,total_reviews,review_rating,url
4217250,Beastfall,2026-04-15,2026-04-16,26.49,22.51,['Raven Games'],['Raven Label'],"Beastfall: Pure Boss Rush × Roguelite. No minions, no mobs — every encounter is a meticulously crafted boss fight. Hone your combat style in fast-paced duels of life and death. On a journey of redemption and revenge, meet gods with conflicting loyalties, and uncover the buried truth.",4,0,https://store.steampowered.com/app/4217250
4492450,El Cipitío: Las Leyendas Cuscatlecas,2026-04-15,2026-04-16,38.79,32.97,"['ILLUSION GAMES', 'Digno Madriles', 'Uriel Blanco']",['ILLUSION GAMES'],El Cipitio and the Cuscatleca Legends is a retro game with 16-bit pixel art style. It is a top-down twin-stick shooter. This 2D shooting game with a top-down perspective combines retro gameplay mechanics with a story based on Salvadoran folklore.,0,0,https://store.steampowered.com/app/4492450
1913310,Undead Tread,2026-04-15,2026-04-16,32.99,29.69,['Fletcher Poole'],['Fletty Games'],"Mow down hordes of zombies in a high-speed vehicular roguelike! Tear through the undead with front-mounted guns, upgrade your car, and battle through procedurally generated highways, cities, and rural roads. Will you reach the cure, or become just another wreck in the apocalypse?",0,0,https://store.steampowered.com/app/1913310
2481500,Blockboy and The Wizard,2026-04-15,2026-04-16,10.49,9.44,['Thorbear Games'],['Thorbear Games'],A game about a boy with a block-shaped head.,1,0,https://store.steampowered.com/app/2481500
4536870,Idle Spin&Win Tower Defense,2026-04-15,2026-04-16,23.21,19.72,['Creative idle studio'],['Creative idle studio'],"Idle Spin&Win combines strategic tower defense, satisfying idle progression, and thrilling luck-based mechanics. Build an impenetrable fortress, unlock devastating abilities, and spin the wheel of fortune to supercharge your defenses against endless enemy waves!",1,0,https://store.steampowered.com/app/4536870
3998790,Empty Gauge,2026-04-15,2026-04-16,11.99,10.79,['Playnova Studio'],['Playnova Studio'],"Um simulador single-player de bicos de terror com clima de VHS. Aguente o turno da madrugada num posto/loja de conveniência isolado e, ao voltar para casa, reúna pistas escondidas. A cada dia, o pesadelo vira realidade — e, conforme as pistas, o final muda.",6,0,https://store.steampowered.com/app/3998790
3974290,Calamity Angels: Special Delivery,2026-04-15,2026-04-16,88.99,75.64,"['Idea Factory', 'Compile Heart']",['Idea Factory International'],First-class fun in this delivery service RPG with a board game twist!,0,0,https://store.steampowered.com/app/3974290
4076070,Frontline: Afrika Korps,2026-04-15,2026-04-16,46.99,42.29,['Frontline: Games Series'],['Frontline: Games Series'],"Lead iconic WWII forces across stunning desert battlefields. Command, customize, and conquer in thrilling, historically rich campaigns. Outsmart foes with Real time strategy cunning tactics. The sands of Africa await!",1,0,https://store.steampowered.com/app/4076070
3905690,Reliquare,2026-04-15,2026-04-16,14.99,13.49,['Sambatti Games'],['Sambatti Games'],"Welcome to Reliquare: a mysterious empty island filled with puzzles based on the classic game of Sudoku. Explore the place and challenge yourself by solving intricate, head-scratching puzzles.",0,0,https://store.steampowered.com/app/3905690
